{
  "$schema": "https://json-schema.org/draft/2020-12/schema",
  "title": "Zoran Manifest",
  "type": "object",
  "properties": {
    "name": {
      "type": "string"
    },
    "version": {
      "type": "string"
    },
    "date": {
      "type": "string"
    },
    "glyph": {
      "type": "string"
    },
    "claims": {
      "type": "array",
      "items": {
        "type": "string"
      }
    },
    "conclusion": {
      "type": "object"
    }
  },
  "required": [
    "name",
    "version",
    "date",
    "glyph"
  ]
}
